[
 {
  "element_id": "RMF:GOVERN-1.1",
  "framework": "AI RMF 1.0",
  "level": "subcategory",
  "parent_id": "RMF:GOVERN-1",
  "code": "GOVERN 1.1",
  "label": "GOVERN 1.1",
  "source_type": "guidance",
  "disposition": "mapped",
  "reason": null,
  "n_controls": 2,
  "n_integral": 1,
  "strongest_property": "integral_to",
  "controls": "GM-CMP-01;GM-CMP-02",
  "review_status": "proposed"
 },
 {
  "element_id": "RMF:GOVERN-1.2",
  "framework": "AI RMF 1.0",
  "level": "subcategory",
  "parent_id": "RMF:GOVERN-1",
  "code": "GOVERN 1.2",
  "label": "GOVERN 1.2",
  "source_type": "guidance",
  "disposition": "mapped",
  "reason": null,
  "n_controls": 1,
  "n_integral": 0,
  "strongest_property": "example_of",
  "controls": "GM-GOV-01",
  "review_status": "proposed"
 },
 {
  "element_id": "RMF:GOVERN-1.3",
  "framework": "AI RMF 1.0",
  "level": "subcategory",
  "parent_id": "RMF:GOVERN-1",
  "code": "GOVERN 1.3",
  "label": "GOVERN 1.3",
  "source_type": "guidance",
  "disposition": "mapped",
  "reason": null,
  "n_controls": 1,
  "n_integral": 0,
  "strongest_property": "example_of",
  "controls": "GM-GOV-01",
  "review_status": "proposed"
 },
 {
  "element_id": "RMF:GOVERN-1.4",
  "framework": "AI RMF 1.0",
  "level": "subcategory",
  "parent_id": "RMF:GOVERN-1",
  "code": "GOVERN 1.4",
  "label": "GOVERN 1.4",
  "source_type": "guidance",
  "disposition": "mapped",
  "reason": null,
  "n_controls": 1,
  "n_integral": 0,
  "strongest_property": "example_of",
  "controls": "GM-GOV-01",
  "review_status": "proposed"
 },
 {
  "element_id": "RMF:GOVERN-1.5",
  "framework": "AI RMF 1.0",
  "level": "subcategory",
  "parent_id": "RMF:GOVERN-1",
  "code": "GOVERN 1.5",
  "label": "GOVERN 1.5",
  "source_type": "guidance",
  "disposition": "mapped",
  "reason": null,
  "n_controls": 1,
  "n_integral": 0,
  "strongest_property": "example_of",
  "controls": "GM-GOV-01",
  "review_status": "proposed"
 },
 {
  "element_id": "RMF:GOVERN-1.6",
  "framework": "AI RMF 1.0",
  "level": "subcategory",
  "parent_id": "RMF:GOVERN-1",
  "code": "GOVERN 1.6",
  "label": "GOVERN 1.6",
  "source_type": "guidance",
  "disposition": "mapped",
  "reason": null,
  "n_controls": 1,
  "n_integral": 1,
  "strongest_property": "integral_to",
  "controls": "GM-GOV-02",
  "review_status": "proposed"
 },
 {
  "element_id": "RMF:GOVERN-1.7",
  "framework": "AI RMF 1.0",
  "level": "subcategory",
  "parent_id": "RMF:GOVERN-1",
  "code": "GOVERN 1.7",
  "label": "GOVERN 1.7",
  "source_type": "guidance",
  "disposition": "mapped",
  "reason": null,
  "n_controls": 2,
  "n_integral": 0,
  "strongest_property": "example_of",
  "controls": "GM-FUN-06;GM-OPS-04",
  "review_status": "proposed"
 },
 {
  "element_id": "RMF:GOVERN-2.1",
  "framework": "AI RMF 1.0",
  "level": "subcategory",
  "parent_id": "RMF:GOVERN-2",
  "code": "GOVERN 2.1",
  "label": "GOVERN 2.1",
  "source_type": "guidance",
  "disposition": "mapped",
  "reason": null,
  "n_controls": 1,
  "n_integral": 0,
  "strongest_property": "example_of",
  "controls": "GM-GOV-01",
  "review_status": "proposed"
 },
 {
  "element_id": "RMF:GOVERN-2.2",
  "framework": "AI RMF 1.0",
  "level": "subcategory",
  "parent_id": "RMF:GOVERN-2",
  "code": "GOVERN 2.2",
  "label": "GOVERN 2.2",
  "source_type": "guidance",
  "disposition": "mapped",
  "reason": null,
  "n_controls": 1,
  "n_integral": 0,
  "strongest_property": "example_of",
  "controls": "GM-GOV-06",
  "review_status": "proposed"
 },
 {
  "element_id": "RMF:GOVERN-2.3",
  "framework": "AI RMF 1.0",
  "level": "subcategory",
  "parent_id": "RMF:GOVERN-2",
  "code": "GOVERN 2.3",
  "label": "GOVERN 2.3",
  "source_type": "guidance",
  "disposition": "out_of_scope",
  "reason": "(2026-10-05 review) Executive leadership responsibility for AI risk decisions is a governance-structure outcome; GAP-M controls name a governance body, not executive accountability.",
  "n_controls": 0,
  "n_integral": 0,
  "strongest_property": null,
  "controls": "",
  "review_status": "proposed"
 },
 {
  "element_id": "RMF:GOVERN-3.1",
  "framework": "AI RMF 1.0",
  "level": "subcategory",
  "parent_id": "RMF:GOVERN-3",
  "code": "GOVERN 3.1",
  "label": "GOVERN 3.1",
  "source_type": "guidance",
  "disposition": "out_of_scope",
  "reason": "Team diversity in risk decisions is an organizational composition outcome; monitoring results do not show it.",
  "n_controls": 0,
  "n_integral": 0,
  "strongest_property": null,
  "controls": "",
  "review_status": "proposed"
 },
 {
  "element_id": "RMF:GOVERN-3.2",
  "framework": "AI RMF 1.0",
  "level": "subcategory",
  "parent_id": "RMF:GOVERN-3",
  "code": "GOVERN 3.2",
  "label": "GOVERN 3.2",
  "source_type": "guidance",
  "disposition": "out_of_scope",
  "reason": "(2026-10-05 review) Defining roles for human-AI configurations is a policy-design activity; GAP-M telemetry observes roles but does not define them.",
  "n_controls": 0,
  "n_integral": 0,
  "strongest_property": null,
  "controls": "",
  "review_status": "proposed"
 },
 {
  "element_id": "RMF:GOVERN-4.1",
  "framework": "AI RMF 1.0",
  "level": "subcategory",
  "parent_id": "RMF:GOVERN-4",
  "code": "GOVERN 4.1",
  "label": "GOVERN 4.1",
  "source_type": "guidance",
  "disposition": "out_of_scope",
  "reason": "A critical-thinking and safety-first culture is an organizational culture outcome, not a monitoring activity.",
  "n_controls": 0,
  "n_integral": 0,
  "strongest_property": null,
  "controls": "",
  "review_status": "proposed"
 },
 {
  "element_id": "RMF:GOVERN-4.2",
  "framework": "AI RMF 1.0",
  "level": "subcategory",
  "parent_id": "RMF:GOVERN-4",
  "code": "GOVERN 4.2",
  "label": "GOVERN 4.2",
  "source_type": "guidance",
  "disposition": "mapped",
  "reason": null,
  "n_controls": 2,
  "n_integral": 0,
  "strongest_property": "example_of",
  "controls": "GM-GOV-05;GM-HF-03",
  "review_status": "proposed"
 },
 {
  "element_id": "RMF:GOVERN-4.3",
  "framework": "AI RMF 1.0",
  "level": "subcategory",
  "parent_id": "RMF:GOVERN-4",
  "code": "GOVERN 4.3",
  "label": "GOVERN 4.3",
  "source_type": "guidance",
  "disposition": "mapped",
  "reason": null,
  "n_controls": 3,
  "n_integral": 0,
  "strongest_property": "example_of",
  "controls": "GM-GOV-04;GM-GOV-05;GM-LSI-01",
  "review_status": "proposed"
 },
 {
  "element_id": "RMF:GOVERN-5.1",
  "framework": "AI RMF 1.0",
  "level": "subcategory",
  "parent_id": "RMF:GOVERN-5",
  "code": "GOVERN 5.1",
  "label": "GOVERN 5.1",
  "source_type": "guidance",
  "disposition": "mapped",
  "reason": null,
  "n_controls": 2,
  "n_integral": 0,
  "strongest_property": "example_of",
  "controls": "GM-HF-01;GM-LSI-03",
  "review_status": "proposed"
 },
 {
  "element_id": "RMF:GOVERN-5.2",
  "framework": "AI RMF 1.0",
  "level": "subcategory",
  "parent_id": "RMF:GOVERN-5",
  "code": "GOVERN 5.2",
  "label": "GOVERN 5.2",
  "source_type": "guidance",
  "disposition": "mapped",
  "reason": null,
  "n_controls": 1,
  "n_integral": 0,
  "strongest_property": "example_of",
  "controls": "GM-HF-01",
  "review_status": "proposed"
 },
 {
  "element_id": "RMF:GOVERN-6.1",
  "framework": "AI RMF 1.0",
  "level": "subcategory",
  "parent_id": "RMF:GOVERN-6",
  "code": "GOVERN 6.1",
  "label": "GOVERN 6.1",
  "source_type": "guidance",
  "disposition": "mapped",
  "reason": null,
  "n_controls": 2,
  "n_integral": 0,
  "strongest_property": "example_of",
  "controls": "GM-GOV-03;GM-SEC-02",
  "review_status": "proposed"
 },
 {
  "element_id": "RMF:GOVERN-6.2",
  "framework": "AI RMF 1.0",
  "level": "subcategory",
  "parent_id": "RMF:GOVERN-6",
  "code": "GOVERN 6.2",
  "label": "GOVERN 6.2",
  "source_type": "guidance",
  "disposition": "mapped",
  "reason": null,
  "n_controls": 1,
  "n_integral": 0,
  "strongest_property": "example_of",
  "controls": "GM-GOV-03",
  "review_status": "proposed"
 },
 {
  "element_id": "RMF:MAP-1.1",
  "framework": "AI RMF 1.0",
  "level": "subcategory",
  "parent_id": "RMF:MAP-1",
  "code": "MAP 1.1",
  "label": "MAP 1.1",
  "source_type": "guidance",
  "disposition": "mapped",
  "reason": null,
  "n_controls": 2,
  "n_integral": 0,
  "strongest_property": "example_of",
  "controls": "GM-CMP-01;GM-CMP-03",
  "review_status": "proposed"
 },
 {
  "element_id": "RMF:MAP-1.2",
  "framework": "AI RMF 1.0",
  "level": "subcategory",
  "parent_id": "RMF:MAP-1",
  "code": "MAP 1.2",
  "label": "MAP 1.2",
  "source_type": "guidance",
  "disposition": "out_of_scope",
  "reason": "Interdisciplinary participation in establishing context is a design-time activity.",
  "n_controls": 0,
  "n_integral": 0,
  "strongest_property": null,
  "controls": "",
  "review_status": "proposed"
 },
 {
  "element_id": "RMF:MAP-1.3",
  "framework": "AI RMF 1.0",
  "level": "subcategory",
  "parent_id": "RMF:MAP-1",
  "code": "MAP 1.3",
  "label": "MAP 1.3",
  "source_type": "guidance",
  "disposition": "out_of_scope",
  "reason": "Documenting the organization's mission and AI goals is a strategy activity that comes before deployment.",
  "n_controls": 0,
  "n_integral": 0,
  "strongest_property": null,
  "controls": "",
  "review_status": "proposed"
 },
 {
  "element_id": "RMF:MAP-1.4",
  "framework": "AI RMF 1.0",
  "level": "subcategory",
  "parent_id": "RMF:MAP-1",
  "code": "MAP 1.4",
  "label": "MAP 1.4",
  "source_type": "guidance",
  "disposition": "mapped",
  "reason": null,
  "n_controls": 1,
  "n_integral": 0,
  "strongest_property": "example_of",
  "controls": "GM-LSI-02",
  "review_status": "proposed"
 },
 {
  "element_id": "RMF:MAP-1.5",
  "framework": "AI RMF 1.0",
  "level": "subcategory",
  "parent_id": "RMF:MAP-1",
  "code": "MAP 1.5",
  "label": "MAP 1.5",
  "source_type": "guidance",
  "disposition": "mapped",
  "reason": null,
  "n_controls": 1,
  "n_integral": 0,
  "strongest_property": "example_of",
  "controls": "GM-FUN-01",
  "review_status": "proposed"
 },
 {
  "element_id": "RMF:MAP-1.6",
  "framework": "AI RMF 1.0",
  "level": "subcategory",
  "parent_id": "RMF:MAP-1",